"No.","Time","Source","Destination","Protocol","Length","Info","TCP header length","DSCP","DSCP Value","QoS","TOS","tcp_delta_time","tcp_rel_time"
"5","0.008065","172.31.187.1","78-59-201-167.static.zebra.lt","TCP","66","35515  >  57857 [ACK] Seq=290 Ack=1449 Win=65535 Len=0 TSval=283399 TSecr=790406671","32","Default","CS0","","","0.000044000","0.000044000"
"10","0.040432","172.31.187.1","190-21-6-36.baf.movistar.cl","TCP","54","4863  >  48462 [ACK] Seq=18 Ack=1441 Win=65535 Len=0","20","Default","CS0","","","0.000025000","0.000025000"
"12","0.050465","172.31.187.1","78-59-201-167.static.zebra.lt","TCP","66","35515  >  57857 [ACK] Seq=290 Ack=4345 Win=65535 Len=0 TSval=283400 TSecr=790406671","32","Default","CS0","","","0.000043000","0.042444000"
"15","0.077949","172.31.187.1","82-169-35-178.fixed.kpn.net","BT-DHT","148","","","Default","CS0","","","",""
"17","0.093462","172.31.187.1","78-59-201-167.static.zebra.lt","TCP","66","35515  >  57857 [ACK] Seq=290 Ack=7241 Win=65535 Len=0 TSval=283400 TSecr=790406671","32","Default","CS0","","","0.000041000","0.085441000"
"21","0.121254","172.31.187.1","78-59-201-167.static.zebra.lt","TCP","66","35515  >  57857 [ACK] Seq=290 Ack=9158 Win=65535 Len=0 TSval=283401 TSecr=790406671","32","Default","CS0","","","0.000036000","0.113233000"
"37","0.152872","172.31.187.1","74.246.217.87.dynamic.jazztel.es","TCP","54","[TCP ACKed unseen segment] 4955  >  18638 [ACK] Seq=1 Ack=2513 Win=65535 Len=0","20","Default","CS0","","","0.000049000","0.000049000"
"38","0.153024","172.31.187.1","74.246.217.87.dynamic.jazztel.es","TCP","71","4955  >  18638 [PSH, ACK] Seq=1 Ack=2513 Win=65535 Len=17","20","Default","CS0","","","0.000152000","0.000201000"
"44","0.214268","172.31.187.1","78-59-201-167.static.zebra.lt","TCP","66","35515  >  57857 [ACK] Seq=290 Ack=12054 Win=65535 Len=0 TSval=283401 TSecr=790406674","32","Default","CS0","","","0.000044000","0.206247000"
"45","0.229898","172.31.187.1","114.205.219.87.dynamic.jazztel.es","TCP","54","4964  >  6881 [ACK] Seq=1 Ack=421 Win=65535 Len=0","20","Default","CS0","","","0.215090000","0.215090000"
"46","0.229920","172.31.187.1","190-21-6-36.baf.movistar.cl","TCP","54","4863  >  48462 [ACK] Seq=18 Ack=2881 Win=65535 Len=0","20","Default","CS0","","","0.124101000","0.189513000"
"47","0.229931","172.31.187.1","212.174.114.237.static.ttnet.com.tr","TCP","54","35515  >  62433 [ACK] Seq=1 Ack=1461 Win=65535 Len=0","20","Default","CS0","","","0.194313000","0.194313000"
"51","0.257869","172.31.187.1","78-59-201-167.static.zebra.lt","TCP","66","35515  >  57857 [ACK] Seq=290 Ack=14950 Win=65535 Len=0 TSval=283402 TSecr=790406674","32","Default","CS0","","","0.000045000","0.249848000"
"54","0.300460","172.31.187.1","78-59-201-167.static.zebra.lt","TCP","66","35515  >  57857 [ACK] Seq=290 Ack=17846 Win=65535 Len=0 TSval=283402 TSecr=790406674","32","Default","CS0","","","0.000039000","0.292439000"
"58","0.341644","172.31.187.1","78-59-201-167.static.zebra.lt","TCP","66","35515  >  57857 [ACK] Seq=290 Ack=20742 Win=65535 Len=0 TSval=283403 TSecr=790406674","32","Default","CS0","","","0.000029000","0.333623000"
"62","0.384430","172.31.187.1","78-59-201-167.static.zebra.lt","TCP","78","35515  >  57857 [ACK] Seq=290 Ack=22190 Win=64087 Len=0 TSval=283403 TSecr=790406674[Packet size limited during capture]","44","Default","CS0","","","0.000019000","0.376409000"
"63","0.386484","172.31.187.1","c-66-229-89-178.hsd1.fl.comcast.net","BT-DHT","148","","","Default","CS0","","","",""
"66","0.407038","172.31.187.1","78-59-201-167.static.zebra.lt","TCP","78","35515  >  57857 [ACK] Seq=290 Ack=22190 Win=64087 Len=0 TSval=283403 TSecr=790406674[Packet size limited during capture]","44","Default","CS0","","","0.000024000","0.399017000"
"67","0.417378","172.31.187.1","87-196-219-109.net.novis.pt","TCP","71","4916  >  19304 [PSH, ACK] Seq=1 Ack=1 Win=65535 Len=17","20","Default","CS0","","","0.000000000","0.000000000"
"69","0.429230","172.31.187.1","78-59-201-167.static.zebra.lt","TCP","78","35515  >  57857 [ACK] Seq=290 Ack=22190 Win=64087 Len=0 TSval=283403 TSecr=790406674[Packet size limited during capture]","44","Default","CS0","","","0.000017000","0.421209000"
"70","0.448608","172.31.187.1","81.202.1.81.dyn.user.ono.com","TCP","54","4926  >  19027 [ACK] Seq=1 Ack=19 Win=65062 Len=0","20","Default","CS0","","","0.206189000","0.206189000"
"71","0.448621","172.31.187.1","114.205.219.87.dynamic.jazztel.es","TCP","54","4964  >  6881 [ACK] Seq=1 Ack=931 Win=65025 Len=0","20","Default","CS0","","","0.111606000","0.433813000"
"73","0.450427","172.31.187.1","78-59-201-167.static.zebra.lt","TCP","86","35515  >  57857 [ACK] Seq=290 Ack=22190 Win=64087 Len=0 TSval=283404 TSecr=790406674[Packet size limited during capture]","52","Default","CS0","","","0.000015000","0.442406000"
"76","0.463511","172.31.187.1","88-123-145-205.subs.proxad.net","BT-DHT","148","","","Default","CS0","","","",""
"78","0.471848","172.31.187.1","78-59-201-167.static.zebra.lt","TCP","86","35515  >  57857 [ACK] Seq=290 Ack=22190 Win=64087 Len=0 TSval=283404 TSecr=790406674[Packet size limited during capture]","52","Default","CS0","","","0.000029000","0.463827000"
"90","0.536065","172.31.187.1","78-59-201-167.static.zebra.lt","TCP","86","35515  >  57857 [ACK] Seq=290 Ack=22190 Win=64087 Len=0 TSval=283404 TSecr=790406674[Packet size limited during capture]","52","Default","CS0","","","0.000036000","0.528044000"
"93","0.557231","172.31.187.1","78-59-201-167.static.zebra.lt","TCP","86","35515  >  57857 [ACK] Seq=290 Ack=22190 Win=64087 Len=0 TSval=283404 TSecr=790406674[Packet size limited during capture]","52","Default","CS0","","","0.000016000","0.549210000"
"94","0.557976","172.31.187.1","dsl-173-221-156-189-dynamic.prod-infinitum.com.mx","TCP","54","35515  >  64660 [ACK] Seq=1 Ack=562 Win=64906 Len=0","20","Default","CS0","","","0.164761000","0.164761000"
"96","0.570432","172.31.187.1","114.205.219.87.dynamic.jazztel.es","TCP","54","4964  >  6881 [ACK] Seq=1 Ack=2977 Win=65535 Len=0","20","Default","CS0","","","0.000019000","0.555624000"
"98","0.577228","172.31.187.1","78-59-201-167.static.zebra.lt","TCP","86","35515  >  57857 [ACK] Seq=290 Ack=22190 Win=64087 Len=0 TSval=283405 TSecr=790406674[Packet size limited during capture]","52","Default","CS0","","","0.000014000","0.569207000"
"103","0.631836","172.31.187.1","pc-166-29-100-190.cm.vtr.net","TCP","54","4946  >  19159 [ACK] Seq=1 Ack=2921 Win=65535 Len=0","20","Default","CS0","","","0.000021000","0.008215000"
"105","0.637436","172.31.187.1","dsl-178-125-146-189-dynamic.prod-infinitum.com.mx","TCP","66","35515  >  59314 [ACK] Seq=1 Ack=2881 Win=65535 Len=0 TSval=283405 TSecr=358623041","32","Default","CS0","","","0.000019000","0.052823000"
"107","0.641919","172.31.187.1","218.81.247.104","BT-DHT","323","","","Default","CS0","","","",""
"109","0.663641","172.31.187.1","78-59-201-167.static.zebra.lt","TCP","86","35515  >  57857 [ACK] Seq=290 Ack=22190 Win=64087 Len=0 TSval=283405 TSecr=790406674[Packet size limited during capture]","52","Default","CS0","","","0.000022000","0.655620000"
"110","0.667343","172.31.187.1","212.174.114.237.static.ttnet.com.tr","TCP","54","35515  >  62433 [ACK] Seq=1 Ack=2921 Win=65535 Len=0","20","Default","CS0","","","0.179730000","0.631725000"
"113","0.683630","172.31.187.1","78-59-201-167.static.zebra.lt","TCP","86","35515  >  57857 [ACK] Seq=290 Ack=22190 Win=64087 Len=0 TSval=283406 TSecr=790406674[Packet size limited during capture]","52","Default","CS0","","","0.000014000","0.675609000"
"116","0.706229","172.31.187.1","78-59-201-167.static.zebra.lt","TCP","86","35515  >  57857 [ACK] Seq=290 Ack=22190 Win=64087 Len=0 TSval=283406 TSecr=790406674[Packet size limited during capture]","52","Default","CS0","","","0.000013000","0.698208000"
"118","0.727635","172.31.187.1","78-59-201-167.static.zebra.lt","TCP","86","35515  >  57857 [ACK] Seq=290 Ack=22190 Win=64087 Len=0 TSval=283406 TSecr=790406674[Packet size limited during capture]","52","Default","CS0","","","0.000017000","0.719614000"
"121","0.748855","172.31.187.1","78-59-201-167.static.zebra.lt","TCP","86","35515  >  57857 [ACK] Seq=290 Ack=22190 Win=64087 Len=0 TSval=283406 TSecr=790406674[Packet size limited during capture]","52","Default","CS0","","","0.000030000","0.740834000"
"124","0.769032","172.31.187.1","78-59-201-167.static.zebra.lt","TCP","86","35515  >  57857 [ACK] Seq=290 Ack=22190 Win=64087 Len=0 TSval=283406 TSecr=790406674[Packet size limited during capture]","52","Default","CS0","","","0.000015000","0.761011000"
"126","0.772831","172.31.187.1","87-196-219-109.net.novis.pt","TCP","54","4916  >  19304 [ACK] Seq=18 Ack=2881 Win=65535 Len=0","20","Default","CS0","","","0.000015000","0.355453000"
"128","0.780840","172.31.187.1","74.246.217.87.dynamic.jazztel.es","TCP","54","4955  >  18638 [ACK] Seq=18 Ack=5397 Win=65535 Len=0","20","Default","CS0","","","0.000020000","0.628017000"
"130","0.791433","172.31.187.1","78-59-201-167.static.zebra.lt","TCP","86","35515  >  57857 [ACK] Seq=290 Ack=22190 Win=64087 Len=0 TSval=283408 TSecr=790406674[Packet size limited during capture]","52","Default","CS0","","","0.000016000","0.783412000"
"135","0.812650","172.31.187.1","78-59-201-167.static.zebra.lt","TCP","86","35515  >  57857 [ACK] Seq=290 Ack=22190 Win=64087 Len=0 TSval=283408 TSecr=790406674[Packet size limited during capture]","52","Default","CS0","","","0.000027000","0.804629000"
"137","0.817235","172.31.187.1","74.246.217.87.dynamic.jazztel.es","TCP","54","4955  >  18638 [ACK] Seq=18 Ack=8281 Win=65535 Len=0","20","Default","CS0","","","0.000018000","0.664412000"
"139","0.825869","172.31.187.1","87-196-219-109.net.novis.pt","TCP","54","4916  >  19304 [ACK] Seq=18 Ack=5761 Win=65535 Len=0","20","Default","CS0","","","0.000041000","0.408491000"
"141","0.832838","172.31.187.1","78-59-201-167.static.zebra.lt","TCP","86","35515  >  57857 [ACK] Seq=290 Ack=22190 Win=64087 Len=0 TSval=283408 TSecr=790406674[Packet size limited during capture]","52","Default","CS0","","","0.000020000","0.824817000"
"144","0.853058","172.31.187.1","74.246.217.87.dynamic.jazztel.es","TCP","54","4955  >  18638 [ACK] Seq=18 Ack=11165 Win=65535 Len=0","20","Default","CS0","","","0.000032000","0.700235000"
"146","0.855437","172.31.187.1","78-59-201-167.static.zebra.lt","TCP","86","35515  >  57857 [ACK] Seq=290 Ack=22190 Win=64087 Len=0 TSval=283408 TSecr=790406674[Packet size limited during capture]","52","Default","CS0","","","0.000019000","0.847416000"
"150","0.876834","172.31.187.1","78-59-201-167.static.zebra.lt","TCP","86","35515  >  57857 [ACK] Seq=290 Ack=22190 Win=64087 Len=0 TSval=283408 TSecr=790406674[Packet size limited during capture]","52","Default","CS0","","","0.000016000","0.868813000"
"151","0.886078","172.31.187.1","85.130.41.152","TCP","62","sbl(1039)  >  19580 [SYN] Seq=0 Win=65535 Len=0 MSS=1460 SACK_PERM","28","Default","CS0","","","0.000000000","0.000000000"
"152","0.886093","172.31.187.1","114.205.219.87.dynamic.jazztel.es","TCP","54","4964  >  6881 [ACK] Seq=1 Ack=3217 Win=65295 Len=0","20","Default","CS0","","","0.211278000","0.871285000"
"153","0.886104","172.31.187.1","81.202.1.81.dyn.user.ono.com","TCP","54","4926  >  19027 [ACK] Seq=1 Ack=322 Win=64759 Len=0","20","Default","CS0","","","0.191289000","0.643685000"
"155","0.888233","172.31.187.1","74.246.217.87.dynamic.jazztel.es","TCP","54","4955  >  18638 [ACK] Seq=18 Ack=14049 Win=65535 Len=0","20","Default","CS0","","","0.000015000","0.735410000"
"157","0.899631","172.31.187.1","78-59-201-167.static.zebra.lt","TCP","86","35515  >  57857 [ACK] Seq=290 Ack=22190 Win=64087 Len=0 TSval=283409 TSecr=790406674[Packet size limited during capture]","52","Default","CS0","","","0.000013000","0.891610000"
"160","0.921236","172.31.187.1","78-59-201-167.static.zebra.lt","TCP","86","35515  >  57857 [ACK] Seq=290 Ack=22190 Win=64087 Len=0 TSval=283409 TSecr=790406674[Packet size limited during capture]","52","Default","CS0","","","0.000017000","0.913215000"
"167","0.964669","172.31.187.1","78-59-201-167.static.zebra.lt","TCP","86","35515  >  57857 [ACK] Seq=290 Ack=22190 Win=64087 Len=0 TSval=283409 TSecr=790406674[Packet size limited during capture]","52","Default","CS0","","","0.000037000","0.956648000"
"169","0.986062","172.31.187.1","78-59-201-167.static.zebra.lt","TCP","86","35515  >  57857 [ACK] Seq=290 Ack=22190 Win=64087 Len=0 TSval=283409 TSecr=790406674[Packet size limited during capture]","52","Default","CS0","","","0.000032000","0.978041000"
"170","0.995458","172.31.187.1","212.174.114.237.static.ttnet.com.tr","TCP","54","35515  >  62433 [ACK] Seq=1 Ack=4381 Win=65535 Len=0","20","Default","CS0","","","0.132241000","0.959840000"
"173","1.009659","172.31.187.1","78-59-201-167.static.zebra.lt","TCP","86","35515  >  57857 [ACK] Seq=290 Ack=22190 Win=64087 Len=0 TSval=283410 TSecr=790406674[Packet size limited during capture]","52","Default","CS0","","","0.000032000","1.001638000"
"175","1.031272","172.31.187.1","78-59-201-167.static.zebra.lt","TCP","86","35515  >  57857 [ACK] Seq=290 Ack=22190 Win=64087 Len=0 TSval=283410 TSecr=790406674[Packet size limited during capture]","52","Default","CS0","","","0.000038000","1.023251000"
"178","1.054869","172.31.187.1","78-59-201-167.static.zebra.lt","TCP","86","35515  >  57857 [ACK] Seq=290 Ack=22190 Win=64087 Len=0 TSval=283410 TSecr=790406674[Packet size limited during capture]","52","Default","CS0","","","0.000036000","1.046848000"
"180","1.075067","172.31.187.1","78-59-201-167.static.zebra.lt","TCP","86","35515  >  57857 [ACK] Seq=290 Ack=22190 Win=64087 Len=0 TSval=283410 TSecr=790406674[Packet size limited during capture]","52","Default","CS0","","","0.000034000","1.067046000"
"182","1.100273","172.31.187.1","78-59-201-167.static.zebra.lt","TCP","86","35515  >  57857 [ACK] Seq=290 Ack=22190 Win=64087 Len=0 TSval=283410 TSecr=790406674[Packet size limited during capture]","52","Default","CS0","","","0.000038000","1.092252000"
"183","1.104824","172.31.187.1","74.246.217.87.dynamic.jazztel.es","TCP","54","4955  >  18638 [ACK] Seq=18 Ack=15491 Win=65535 Len=0","20","Default","CS0","","","0.157005000","0.952001000"
"185","1.123071","172.31.187.1","78-59-201-167.static.zebra.lt","TCP","86","35515  >  57857 [ACK] Seq=290 Ack=22190 Win=64087 Len=0 TSval=283411 TSecr=790406674[Packet size limited during capture]","52","Default","CS0","","","0.000037000","1.115050000"
"187","1.145274","172.31.187.1","78-59-201-167.static.zebra.lt","TCP","86","35515  >  57857 [ACK] Seq=290 Ack=22190 Win=64087 Len=0 TSval=283411 TSecr=790406674[Packet size limited during capture]","52","Default","CS0","","","0.000038000","1.137253000"
"189","1.169510","172.31.187.1","78-59-201-167.static.zebra.lt","TCP","86","35515  >  57857 [ACK] Seq=290 Ack=22190 Win=64087 Len=0 TSval=283411 TSecr=790406674[Packet size limited during capture]","52","Default","CS0","","","0.000035000","1.161489000"
"191","1.189657","172.31.187.1","78-59-201-167.static.zebra.lt","TCP","86","35515  >  57857 [ACK] Seq=290 Ack=22190 Win=64087 Len=0 TSval=283411 TSecr=790406674[Packet size limited during capture]","52","Default","CS0","","","0.000029000","1.181636000"
"194","1.211860","172.31.187.1","78-59-201-167.static.zebra.lt","TCP","86","35515  >  57857 [ACK] Seq=290 Ack=22190 Win=64087 Len=0 TSval=283411 TSecr=790406674[Packet size limited during capture]","52","Default","CS0","","","0.000029000","1.203839000"
"195","1.214182","172.31.187.1","114.205.219.87.dynamic.jazztel.es","TCP","54","4964  >  6881 [ACK] Seq=1 Ack=4557 Win=65535 Len=0","20","Default","CS0","","","0.210953000","1.199374000"
"197","1.233267","172.31.187.1","78-59-201-167.static.zebra.lt","TCP","86","35515  >  57857 [ACK] Seq=290 Ack=22190 Win=64087 Len=0 TSval=283412 TSecr=790406674[Packet size limited during capture]","52","Default","CS0","","","0.000035000","1.225246000"
"200","1.254251","172.31.187.1","78-59-201-167.static.zebra.lt","TCP","86","35515  >  57857 [ACK] Seq=290 Ack=22190 Win=64087 Len=0 TSval=283412 TSecr=790406674[Packet size limited during capture]","52","Default","CS0","","","0.000028000","1.246230000"
"202","1.274868","172.31.187.1","78-59-201-167.static.zebra.lt","TCP","86","35515  >  57857 [ACK] Seq=290 Ack=22190 Win=64087 Len=0 TSval=283412 TSecr=790406674[Packet size limited during capture]","52","Default","CS0","","","0.000034000","1.266847000"
"206","1.343284","172.31.187.1","114.205.219.87.dynamic.jazztel.es","TCP","54","4964  >  6881 [ACK] Seq=1 Ack=6816 Win=65535 Len=0","20","Default","CS0","","","0.000044000","1.328476000"
"209","1.395321","172.31.187.1","c-213-112-80-192.bbcust.telenor.se","TCP","62","35515  >  63679 [SYN, ACK] Seq=0 Ack=1 Win=65535 Len=0 MSS=1460 SACK_PERM","28","Default","CS0","","","0.000076000","0.000076000"
"210","1.402182","172.31.187.1","216-59-242-186.ded.execulink.com","BT-DHT","148","","","Default","CS0","","","",""
"211","1.432947","172.31.187.1","212.174.114.237.static.ttnet.com.tr","TCP","54","35515  >  62433 [ACK] Seq=1 Ack=5841 Win=65535 Len=0","20","Default","CS0","","","0.178911000","1.397329000"
"212","1.432971","172.31.187.1","78-59-201-167.static.zebra.lt","TCP","86","35515  >  57857 [ACK] Seq=290 Ack=23638 Win=65535 Len=0 TSval=283414 TSecr=790406685[Packet size limited during capture]","52","Default","CS0","","","0.135935000","1.424950000"
"213","1.432986","172.31.187.1","190-21-6-36.baf.movistar.cl","TCP","71","[TCP Retransmission] 4863  >  48462 [PSH, ACK] Seq=1 Ack=2881 Win=65535 Len=17","20","Default","CS0","","","1.203066000","1.392579000"
"214","1.433057","172.31.187.1","pc-128-30-161-190.cm.vtr.net","TCP","71","4865  >  55970 [PSH, ACK] Seq=1 Ack=1 Win=65535 Len=17","20","Default","CS0","","","0.000000000","0.000000000"
"215","1.433081","172.31.187.1","dsl-173-221-156-189-dynamic.prod-infinitum.com.mx","TCP","59","35515  >  64660 [PSH, ACK] Seq=1 Ack=562 Win=64906 Len=5","20","Default","CS0","","","0.875105000","1.039866000"
"219","1.460475","172.31.187.1","pc-166-29-100-190.cm.vtr.net","TCP","54","4946  >  19159 [ACK] Seq=1 Ack=4718 Win=65535 Len=0","20","Default","CS0","","","0.000038000","0.836854000"
"220","1.460635","172.31.187.1","pc-166-29-100-190.cm.vtr.net","TCP","71","4946  >  19159 [PSH, ACK] Seq=1 Ack=4718 Win=65535 Len=17","20","Default","CS0","","","0.000160000","0.837014000"
"224","1.504395","172.31.187.1","c-213-112-80-192.bbcust.telenor.se","TCP","122","35515  >  63679 [PSH, ACK] Seq=1 Ack=49 Win=65487 Len=68","20","Default","CS0","","","0.000150000","0.109150000"
"225","1.542302","172.31.187.1","81.202.1.81.dyn.user.ono.com","TCP","54","4926  >  19027 [ACK] Seq=1 Ack=331 Win=64750 Len=0","20","Default","CS0","","","0.170863000","1.299883000"
"228","1.574262","172.31.187.1","74.246.217.87.dynamic.jazztel.es","TCP","54","4955  >  18638 [ACK] Seq=18 Ack=18375 Win=65535 Len=0","20","Default","CS0","","","0.000030000","1.421439000"
"230","1.577857","172.31.187.1","78-59-201-167.static.zebra.lt","TCP","86","35515  >  57857 [ACK] Seq=290 Ack=26534 Win=65535 Len=0 TSval=283415 TSecr=790406689[Packet size limited during capture]","52","Default","CS0","","","0.000029000","1.569836000"
"232","1.595195","172.31.187.1","74.246.217.87.dynamic.jazztel.es","TCP","71","4955  >  18638 [PSH, ACK] Seq=18 Ack=19817 Win=65535 Len=17","20","Default","CS0","","","0.000160000","1.442372000"
"236","1.619245","172.31.187.1","78-59-201-167.static.zebra.lt","TCP","86","35515  >  57857 [ACK] Seq=290 Ack=29430 Win=65535 Len=0 TSval=283415 TSecr=790406689[Packet size limited during capture]","52","Default","CS0","","","0.000017000","1.611224000"
"238","1.629648","172.31.187.1","74.246.217.87.dynamic.jazztel.es","TCP","54","4955  >  18638 [ACK] Seq=35 Ack=22701 Win=65535 Len=0","20","Default","CS0","","","0.000019000","1.476825000"
"240","1.640851","172.31.187.1","78-59-201-167.static.zebra.lt","TCP","86","35515  >  57857 [ACK] Seq=290 Ack=30878 Win=64087 Len=0 TSval=283415 TSecr=790406690[Packet size limited during capture]","52","Default","CS0","","","0.000023000","1.632830000"
"242","1.650053","172.31.187.1","78-59-201-167.static.zebra.lt","TCP","78","35515  >  57857 [ACK] Seq=290 Ack=35691 Win=65535 Len=0 TSval=283415 TSecr=790406690[Packet size limited during capture]","44","Default","CS0","","","0.000025000","1.642032000"
"243","1.651651","172.31.187.1","114.205.219.87.dynamic.jazztel.es","TCP","54","4964  >  6881 [ACK] Seq=1 Ack=6936 Win=65415 Len=0","20","Default","CS0","","","0.205609000","1.636843000"
"246","1.676307","172.31.187.1","78-59-201-167.static.zebra.lt","TCP","66","35515  >  57857 [ACK] Seq=290 Ack=84923 Win=65535 Len=0 TSval=283416 TSecr=790406690","32","Default","CS0","","","0.000077000","1.668286000"
"253","1.701654","172.31.187.1","74.246.217.87.dynamic.jazztel.es","TCP","54","4955  >  18638 [ACK] Seq=35 Ack=25585 Win=65535 Len=0","20","Default","CS0","","","0.000025000","1.548831000"
"255","1.712847","172.31.187.1","c-213-112-80-192.bbcust.telenor.se","TCP","54","35515  >  63679 [ACK] Seq=69 Ack=50 Win=65487 Len=0","20","Default","CS0","","","0.000018000","0.317602000"
"256","1.712950","172.31.187.1","c-213-112-80-192.bbcust.telenor.se","TCP","54","35515  >  63679 [FIN, ACK] Seq=69 Ack=50 Win=65487 Len=0","20","Default","CS0","","","0.000103000","0.317705000"
"259","1.735648","172.31.187.1","74.246.217.87.dynamic.jazztel.es","TCP","54","4955  >  18638 [ACK] Seq=35 Ack=28469 Win=65535 Len=0","20","Default","CS0","","","0.000019000","1.582825000"
"269","1.838269","172.31.187.1","114.205.219.87.dynamic.jazztel.es","TCP","54","4964  >  6881 [ACK] Seq=1 Ack=9758 Win=65535 Len=0","20","Default","CS0","","","0.000030000","1.823461000"
"271","1.870391","172.31.187.1","dsl-63-116-143-189-dynamic.prod-infinitum.com.mx","TCP","66","35515  >  itose(4348) [ACK] Seq=1 Ack=1453 Win=65535 Len=0 SLE=2905 SRE=3631","32","Default","CS0","","","0.192755000","0.192755000"
"272","1.870407","172.31.187.1","212.174.114.237.static.ttnet.com.tr","TCP","54","35515  >  62433 [ACK] Seq=1 Ack=7301 Win=65535 Len=0","20","Default","CS0","","","0.180178000","1.834789000"
"273","1.870419","172.31.187.1","81.202.1.81.dyn.user.ono.com","TCP","54","4926  >  19027 [ACK] Seq=1 Ack=349 Win=64732 Len=0","20","Default","CS0","","","0.177790000","1.628000000"
"275","1.920667","172.31.187.1","78-59-201-167.static.zebra.lt","TCP","66","35515  >  57857 [ACK] Seq=290 Ack=87725 Win=65535 Len=0 TSval=283418 TSecr=790406695","32","Default","CS0","","","0.000029000","1.912646000"
"280","1.964859","172.31.187.1","78-59-201-167.static.zebra.lt","TCP","66","35515  >  57857 [ACK] Seq=290 Ack=90621 Win=65535 Len=0 TSval=283418 TSecr=790406697","32","Default","CS0","","","0.000023000","1.956838000"
"283","2.007251","172.31.187.1","78-59-201-167.static.zebra.lt","TCP","66","35515  >  57857 [ACK] Seq=290 Ack=93517 Win=65535 Len=0 TSval=283420 TSecr=790406697","32","Default","CS0","","","0.000017000","1.999230000"
"286","2.089123","172.31.187.1","114.205.219.87.dynamic.jazztel.es","TCP","54","4964  >  6881 [ACK] Seq=1 Ack=10203 Win=65090 Len=0","20","Default","CS0","","","0.144290000","2.074315000"
"291","2.142261","172.31.187.1","pc-166-29-100-190.cm.vtr.net","TCP","54","4946  >  19159 [ACK] Seq=18 Ack=7638 Win=65535 Len=0","20","Default","CS0","","","0.000024000","1.518640000"
"292","2.198497","172.31.187.1","78-59-201-167.static.zebra.lt","TCP","66","35515  >  57857 [ACK] Seq=290 Ack=94965 Win=64087 Len=0 TSval=283422 TSecr=790406697","32","Default","CS0","","","0.169062000","2.190476000"
"294","2.207257","172.31.187.1","host236.201-252-188.telecom.net.ar","TCP","66","[TCP ACKed unseen segment] 35515  >  62154 [ACK] Seq=1 Ack=5761 Win=65535 Len=0 TSval=283422 TSecr=285775426","32","Default","CS0","","","0.000017000","0.000017000"
"298","2.291866","172.31.187.1","78-59-201-167.static.zebra.lt","TCP","66","35515  >  57857 [ACK] Seq=290 Ack=97861 Win=65535 Len=0 TSval=283422 TSecr=790406700","32","Default","CS0","","","0.000026000","2.283845000"
"299","2.307854","172.31.187.1","212.174.114.237.static.ttnet.com.tr","TCP","54","35515  >  62433 [ACK] Seq=1 Ack=8761 Win=65535 Len=0","20","Default","CS0","","","0.206415000","2.272236000"
"300","2.307867","172.31.187.1","74.246.217.87.dynamic.jazztel.es","TCP","54","4955  >  18638 [ACK] Seq=35 Ack=29911 Win=65535 Len=0","20","Default","CS0","","","0.179832000","2.155044000"
"305","2.337859","172.31.187.1","78-59-201-167.static.zebra.lt","TCP","66","35515  >  57857 [ACK] Seq=290 Ack=100757 Win=65535 Len=0 TSval=283423 TSecr=790406700","32","Default","CS0","","","0.000021000","2.329838000"
"307","2.348861","172.31.187.1","74.246.217.87.dynamic.jazztel.es","TCP","54","4955  >  18638 [ACK] Seq=35 Ack=32795 Win=65535 Len=0","20","Default","CS0","","","0.000021000","2.196038000"
"311","2.380295","172.31.187.1","78-59-201-167.static.zebra.lt","TCP","66","35515  >  57857 [ACK] Seq=290 Ack=103653 Win=65535 Len=0 TSval=283423 TSecr=790406700","32","Default","CS0","","","0.000044000","2.372274000"
"313","2.401976","172.31.187.1","host-93-124-46-231.dsl.sura.ru","BT-DHT","148","","","Default","CS0","","","",""
"314","2.402017","172.31.187.1","8.122.212.218.starhub.net.sg","BT-DHT","148","","","Default","CS0","","","",""
"315","2.402067","172.31.187.1","80-162-81-130-static.dk.customer.tdc.net","BT-DHT","148","","","Default","CS0","","","",""
"317","2.417247","172.31.187.1","213.154.92.11","TCP","62","netarx(1040)  >  57132 [SYN] Seq=0 Win=65535 Len=0 MSS=1460 SACK_PERM","28","Default","CS0","","","0.000000000","0.000000000"
"318","2.417270","172.31.187.1","77.247.176.151","TCP","62","danf-ak2(1041)  >  http(80) [SYN] Seq=0 Win=65535 Len=0 MSS=1460 SACK_PERM","28","Default","CS0","","","0.000000000","0.000000000"
"319","2.417284","172.31.187.1","ely0-09-b2-v4wan-169668-cust2094.vm43.cable.virginm.net","TCP","62","afrog(1042)  >  61943 [SYN] Seq=0 Win=65535 Len=0 MSS=1460 SACK_PERM","28","Default","CS0","","","0.000000000","0.000000000"
"320","2.417306","172.31.187.1","114.205.219.87.dynamic.jazztel.es","TCP","54","4964  >  6881 [ACK] Seq=1 Ack=10683 Win=64610 Len=0","20","Default","CS0","","","0.204671000","2.402498000"
"322","2.427312","172.31.187.1","78-59-201-167.static.zebra.lt","TCP","66","35515  >  57857 [ACK] Seq=290 Ack=106549 Win=65535 Len=0 TSval=283424 TSecr=790406700","32","Default","CS0","","","0.000053000","2.419291000"
"325","2.464682","172.31.187.1","dsl-178-125-146-189-dynamic.prod-infinitum.com.mx","TCP","66","[TCP Dup ACK 105#1] 35515  >  59314 [ACK] Seq=1 Ack=2881 Win=65535 Len=0 TSval=283424 TSecr=358623041","32","Default","CS0","","","0.000032000","1.880069000"
"327","2.469859","172.31.187.1","78-59-201-167.static.zebra.lt","TCP","66","35515  >  57857 [ACK] Seq=290 Ack=109445 Win=65535 Len=0 TSval=283424 TSecr=790406701","32","Default","CS0","","","0.000020000","2.461838000"
"330","2.478061","172.31.187.1","77.247.176.151","TCP","54","danf-ak2(1041)  >  http(80) [ACK] Seq=1 Ack=1 Win=65535 Len=0","20","Default","CS0","","","0.000021000","0.060791000"
"331","2.478147","172.31.187.1","77.247.176.151","HTTP","393","Continuation[Packet size limited during capture]","20","Default","CS0","","","0.000086000","0.060877000"
"333","2.526589","172.31.187.1","81.202.1.81.dyn.user.ono.com","TCP","54","4926  >  19027 [ACK] Seq=1 Ack=358 Win=64723 Len=0","20","Default","CS0","","","0.217750000","2.284170000"
"334","2.526605","172.31.187.1","190-21-6-36.baf.movistar.cl","TCP","54","4863  >  48462 [ACK] Seq=18 Ack=4321 Win=65535 Len=0","20","Default","CS0","","","0.153551000","2.486198000"
"337","2.538285","172.31.187.1","78-59-201-167.static.zebra.lt","TCP","66","35515  >  57857 [ACK] Seq=290 Ack=112341 Win=65535 Len=0 TSval=283425 TSecr=790406701","32","Default","CS0","","","0.000036000","2.530264000"
"340","2.550054","172.31.187.1","host236.201-252-188.telecom.net.ar","TCP","66","[TCP Dup ACK 294#1] 35515  >  62154 [ACK] Seq=1 Ack=5761 Win=65535 Len=0 TSval=283425 TSecr=285775426","32","Default","CS0","","","0.000014000","0.342814000"
"344","2.575771","172.31.187.1","77.247.176.151","TCP","54","danf-ak2(1041)  >  http(80) [FIN, ACK] Seq=340 Ack=151 Win=65385 Len=0","20","Default","CS0","","","0.000129000","0.158501000"
"346","2.576855","172.31.187.1","77.247.176.151","TCP","54","danf-ak2(1041)  >  http(80) [ACK] Seq=341 Ack=152 Win=65385 Len=0","20","Default","CS0","","","0.000013000","0.159585000"
"348","2.603274","172.31.187.1","78-59-201-167.static.zebra.lt","TCP","66","35515  >  57857 [ACK] Seq=290 Ack=115237 Win=65535 Len=0 TSval=283425 TSecr=790406703","32","Default","CS0","","","0.000027000","2.595253000"
"350","2.603857","172.31.187.1","host236.201-252-188.telecom.net.ar","TCP","66","[TCP Dup ACK 294#2] 35515  >  62154 [ACK] Seq=1 Ack=5761 Win=65535 Len=0 TSval=283425 TSecr=285775426","32","Default","CS0","","","0.000016000","0.396617000"
"352","2.635978","172.31.187.1","212.174.114.237.static.ttnet.com.tr","TCP","54","35515  >  62433 [ACK] Seq=1 Ack=10221 Win=65535 Len=0","20","Default","CS0","","","0.164939000","2.600360000"
"360","2.645060","172.31.187.1","78-59-201-167.static.zebra.lt","TCP","66","35515  >  57857 [ACK] Seq=290 Ack=118133 Win=65535 Len=0 TSval=283426 TSecr=790406703","32","Default","CS0","","","0.000018000","2.637039000"
"363","2.745341","172.31.187.1","114.205.219.87.dynamic.jazztel.es","TCP","54","4964  >  6881 [ACK] Seq=1 Ack=11713 Win=65535 Len=0","20","Default","CS0","","","0.211286000","2.730533000"
"365","2.751273","172.31.187.1","78-59-201-167.static.zebra.lt","TCP","66","35515  >  57857 [ACK] Seq=290 Ack=121029 Win=65535 Len=0 TSval=283427 TSecr=790406703","32","Default","CS0","","","0.000024000","2.743252000"
"369","2.793671","172.31.187.1","78-59-201-167.static.zebra.lt","TCP","66","35515  >  57857 [ACK] Seq=290 Ack=123925 Win=65535 Len=0 TSval=283427 TSecr=790406704","32","Default","CS0","","","0.000026000","2.785650000"
"374","2.801875","172.31.187.1","pc-166-29-100-190.cm.vtr.net","TCP","66","[TCP Dup ACK 291#1] 4946  >  19159 [ACK] Seq=18 Ack=7638 Win=65535 Len=0 SLE=9098 SRE=10558","32","Default","CS0","","","0.000026000","2.178254000"
"378","2.826687","172.31.187.1","87-196-219-109.net.novis.pt","TCP","54","4916  >  19304 [ACK] Seq=18 Ack=8641 Win=65535 Len=0","20","Default","CS0","","","0.000034000","2.409309000"
"380","2.830262","172.31.187.1","pc-166-29-100-190.cm.vtr.net","TCP","66","[TCP Dup ACK 291#2] 4946  >  19159 [ACK] Seq=18 Ack=7638 Win=65535 Len=0 SLE=9098 SRE=12018","32","Default","CS0","","","0.000018000","2.206641000"
"382","2.836473","172.31.187.1","78-59-201-167.static.zebra.lt","TCP","66","35515  >  57857 [ACK] Seq=290 Ack=126821 Win=65535 Len=0 TSval=283427 TSecr=790406704","32","Default","CS0","","","0.000025000","2.828452000"
"385","2.854706","172.31.187.1","host236.201-252-188.telecom.net.ar","TCP","66","35515  >  62154 [ACK] Seq=1 Ack=7201 Win=64095 Len=0 TSval=283428 TSecr=285775468","32","Default","CS0","","","0.197661000","0.647466000"
"388","2.878903","172.31.187.1","78-59-201-167.static.zebra.lt","TCP","66","35515  >  57857 [ACK] Seq=290 Ack=129717 Win=65535 Len=0 TSval=283428 TSecr=790406704","32","Default","CS0","","","0.000044000","2.870882000"
"393","2.922506","172.31.187.1","78-59-201-167.static.zebra.lt","TCP","66","35515  >  57857 [ACK] Seq=290 Ack=132613 Win=65535 Len=0 TSval=283428 TSecr=790406704","32","Default","CS0","","","0.000045000","2.914485000"
"395","2.922537","172.31.187.1","pc-128-30-161-190.cm.vtr.net","TCP","54","4865  >  55970 [ACK] Seq=18 Ack=2921 Win=65535 Len=0","20","Default","CS0","","","0.000017000","1.489480000"
"397","2.939088","172.31.187.1","87-196-219-109.net.novis.pt","TCP","54","4916  >  19304 [ACK] Seq=18 Ack=11521 Win=65535 Len=0","20","Default","CS0","","","0.000036000","2.521710000"
"400","2.964065","172.31.187.1","159.red-212-170-166.staticip.rima-tde.net","TCP","66","35515  >  29890 [ACK] Seq=1 Ack=336 Win=64514 Len=0 TSval=283429 TSecr=980369258","32","Default","CS0","","","0.170810000","0.170810000"
"401","2.964082","172.31.187.1","212.174.114.237.static.ttnet.com.tr","TCP","54","35515  >  62433 [ACK] Seq=1 Ack=11681 Win=65535 Len=0","20","Default","CS0","","","0.118421000","2.928464000"
"402","2.964094","172.31.187.1","114.205.219.87.dynamic.jazztel.es","TCP","54","4964  >  6881 [ACK] Seq=1 Ack=12163 Win=65085 Len=0","20","Default","CS0","","","0.110233000","2.949286000"
"404","2.965274","172.31.187.1","78-59-201-167.static.zebra.lt","TCP","66","35515  >  57857 [ACK] Seq=290 Ack=135509 Win=65535 Len=0 TSval=283429 TSecr=790406705","32","Default","CS0","","","0.000024000","2.957253000"
"406","2.973077","172.31.187.1","pc-128-30-161-190.cm.vtr.net","TCP","54","4865  >  55970 [ACK] Seq=18 Ack=5841 Win=65535 Len=0","20","Default","CS0","","","0.000026000","1.540020000"
"409","3.009681","172.31.187.1","78-59-201-167.static.zebra.lt","TCP","66","35515  >  57857 [ACK] Seq=290 Ack=138405 Win=65535 Len=0 TSval=283429 TSecr=790406705","32","Default","CS0","","","0.000029000","3.001660000"
"413","3.051285","172.31.187.1","78-59-201-167.static.zebra.lt","TCP","66","35515  >  57857 [ACK] Seq=290 Ack=141301 Win=65535 Len=0 TSval=283429 TSecr=790406705","32","Default","CS0","","","0.000031000","3.043264000"
"418","3.117450","172.31.187.1","host236.201-252-188.telecom.net.ar","TCP","83","35515  >  62154 [PSH, ACK] Seq=1 Ack=8641 Win=65535 Len=17 TSval=283431 TSecr=285775471[Packet size limited during capture]","32","Default","CS0","","","0.000199000","0.910210000"
"420","3.157702","172.31.187.1","78-59-201-167.static.zebra.lt","TCP","66","35515  >  57857 [ACK] Seq=290 Ack=144197 Win=65535 Len=0 TSval=283431 TSecr=790406705","32","Default","CS0","","","0.000040000","3.149681000"
"424","3.182796","172.31.187.1","pc-128-30-161-190.cm.vtr.net","TCP","54","4865  >  55970 [ACK] Seq=18 Ack=7301 Win=65535 Len=0","20","Default","CS0","","","0.154540000","1.749739000"
"426","3.201689","172.31.187.1","78-59-201-167.static.zebra.lt","TCP","66","35515  >  57857 [ACK] Seq=290 Ack=147093 Win=65535 Len=0 TSval=283432 TSecr=790406706","32","Default","CS0","","","0.000031000","3.193668000"
"430","3.266698","172.31.187.1","78-59-201-167.static.zebra.lt","TCP","66","35515  >  57857 [ACK] Seq=290 Ack=149989 Win=65535 Len=0 TSval=283432 TSecr=790406707","32","Default","CS0","","","0.000037000","3.258677000"
"432","3.292164","172.31.187.1","114.205.219.87.dynamic.jazztel.es","TCP","54","4964  >  6881 [ACK] Seq=1 Ack=13416 Win=65535 Len=0","20","Default","CS0","","","0.179505000","3.277356000"
"433","3.292181","172.31.187.1","201-223-19-187.baf.movistar.cl","TCP","54","4890  >  53813 [ACK] Seq=1 Ack=309 Win=64476 Len=0","20","Default","CS0","","","0.131732000","0.131732000"
"434","3.292194","172.31.187.1","host236.201-252-188.telecom.net.ar","TCP","66","35515  >  62154 [ACK] Seq=18 Ack=10081 Win=64095 Len=0 TSval=283433 TSecr=285775471","32","Default","CS0","","","0.110144000","1.084954000"
"437","3.371677","172.31.187.1","78-59-201-167.static.zebra.lt","TCP","66","35515  >  57857 [ACK] Seq=290 Ack=152885 Win=65535 Len=0 TSval=283433 TSecr=790406707","32","Default","CS0","","","0.000025000","3.363656000"
"439","3.381270","172.31.187.1","pc-166-29-100-190.cm.vtr.net","TCP","66","[TCP Dup ACK 291#3] 4946  >  19159 [ACK] Seq=18 Ack=7638 Win=65535 Len=0 SLE=9098 SRE=13478","32","Default","CS0","","","0.000018000","2.757649000"
"441","3.393519","172.31.187.1","84.32.127.187","BT-DHT","109","","","Default","CS0","","","",""
"442","3.393595","172.31.187.1","n219079009224.netvigator.com","BT-DHT","148","","","Default","CS0","","","",""
"444","3.401533","172.31.187.1","212.174.114.237.static.ttnet.com.tr","TCP","54","35515  >  62433 [ACK] Seq=1 Ack=13141 Win=65535 Len=0","20","Default","CS0","","","0.176483000","3.365915000"
"446","3.431918","172.31.187.1","pc-166-29-100-190.cm.vtr.net","TCP","54","4946  >  19159 [ACK] Seq=18 Ack=13478 Win=65535 Len=0","20","Default","CS0","","","0.000053000","2.808297000"
"447","3.432015","172.31.187.1","pc-166-29-100-190.cm.vtr.net","TCP","71","4946  >  19159 [PSH, ACK] Seq=18 Ack=13478 Win=65535 Len=17","20","Default","CS0","","","0.000097000","2.808394000"
"449","3.443905","172.31.187.1","dsl-63-116-143-189-dynamic.prod-infinitum.com.mx","TCP","54","[TCP ACKed unseen segment] 35515  >  itose(4348) [ACK] Seq=1 Ack=3631 Win=65535 Len=0","20","Default","CS0","","","0.000043000","1.766269000"
"451","3.447179","172.31.187.1","114.205.219.87.dynamic.jazztel.es","BitTorrent","71","Request[Packet size limited during capture]","20","Default","CS0","","","0.000126000","3.432371000"
"454","3.486101","172.31.187.1","190-21-6-36.baf.movistar.cl","TCP","54","4863  >  48462 [ACK] Seq=18 Ack=6318 Win=65535 Len=0","20","Default","CS0","","","0.000036000","3.445694000"
"455","3.510902","172.31.187.1","a213-22-94-135.cpe.netcabo.pt","TCP","54","lyskom(4894)  >  10849 [ACK] Seq=1 Ack=1461 Win=65535 Len=0","20","Default","CS0","","","0.154838000","0.154838000"
"456","3.510922","172.31.187.1","78-59-201-167.static.zebra.lt","TCP","66","35515  >  57857 [ACK] Seq=290 Ack=154333 Win=64087 Len=0 TSval=283435 TSecr=790406708","32","Default","CS0","","","0.117863000","3.502901000"
"459","3.542307","172.31.187.1","78-59-201-167.static.zebra.lt","TCP","66","35515  >  57857 [ACK] Seq=290 Ack=157229 Win=65535 Len=0 TSval=283435 TSecr=790406708","32","Default","CS0","","","0.000039000","3.534286000"
"464","3.586105","172.31.187.1","78-59-201-167.static.zebra.lt","TCP","66","35515  >  57857 [ACK] Seq=290 Ack=160125 Win=65535 Len=0 TSval=283435 TSecr=790406709","32","Default","CS0","","","0.000039000","3.578084000"
"467","3.612959","172.31.187.1","78-59-201-167.static.zebra.lt","TCP","389","35515  >  57857 [PSH, ACK] Seq=290 Ack=161573 Win=64087 Len=323 TSval=283435 TSecr=790406709[Packet size limited during capture]","32","Default","CS0","","","0.005289000","3.604938000"
"470","3.650085","172.31.187.1","78-59-201-167.static.zebra.lt","TCP","66","35515  >  57857 [ACK] Seq=613 Ack=164469 Win=65535 Len=0 TSval=283436 TSecr=790406710","32","Default","CS0","","","0.000027000","3.642064000"
"473","3.705297","172.31.187.1","78-59-201-167.static.zebra.lt","TCP","66","35515  >  57857 [ACK] Seq=613 Ack=167365 Win=65535 Len=0 TSval=283436 TSecr=790406710","32","Default","CS0","","","0.000033000","3.697276000"
"475","3.729639","172.31.187.1","dsl-178-125-146-189-dynamic.prod-infinitum.com.mx","TCP","66","35515  >  59314 [ACK] Seq=1 Ack=4321 Win=64095 Len=0 TSval=283437 TSecr=358623069","32","Default","CS0","","","0.149767000","3.145026000"
"476","3.729657","172.31.187.1","212.174.114.237.static.ttnet.com.tr","TCP","54","35515  >  62433 [ACK] Seq=1 Ack=14601 Win=65535 Len=0","20","Default","CS0","","","0.135587000","3.694039000"
"477","3.729669","172.31.187.1","114.205.219.87.dynamic.jazztel.es","TCP","54","4964  >  6881 [ACK] Seq=18 Ack=14346 Win=64605 Len=0","20","Default","CS0","","","0.178000000","3.714861000"
"480","3.753082","172.31.187.1","78-59-201-167.static.zebra.lt","TCP","66","35515  >  57857 [ACK] Seq=613 Ack=170261 Win=65535 Len=0 TSval=283437 TSecr=790406711","32","Default","CS0","","","0.000025000","3.745061000"
"483","3.794901","172.31.187.1","78-59-201-167.static.zebra.lt","TCP","66","35515  >  57857 [ACK] Seq=613 Ack=173157 Win=65535 Len=0 TSval=283437 TSecr=790406711","32","Default","CS0","","","0.000034000","3.786880000"
"486","3.839026","172.31.187.1","89.211.2.3","TCP","62","boinc-client(1043)  >  11991 [SYN] Seq=0 Win=65535 Len=0 MSS=1460 SACK_PERM","28","Default","CS0","","","0.000000000","0.000000000"
"488","3.879798","172.31.187.1","78-61-239-45.static.zebra.lt","BT-DHT","148","","","Default","CS0","","","",""
"491","3.923695","172.31.187.1","78-59-201-167.static.zebra.lt","TCP","66","35515  >  57857 [ACK] Seq=613 Ack=176053 Win=65535 Len=0 TSval=283438 TSecr=790406712","32","Default","CS0","","","0.000032000","3.915674000"
"493","3.948365","172.31.187.1","81.202.1.81.dyn.user.ono.com","TCP","54","4926  >  19027 [ACK] Seq=1 Ack=367 Win=64714 Len=0","20","Default","CS0","","","0.197297000","3.705946000"
